id;cleaned_words;subreddit
7z9g6u;impost syndrom data scientist work data scientist consult compani various domain bioinformat iot pharma near three year read lot post feel know much test job market pass interview larg compani known analyt guid handbook list thing one know data scientist use scratch surfac http www itshar org 2015 10 data scienc interview question html mathemat;datascience
7z9djd;much vacat time get peopl work data scienc realm data analyst data scientist even data engin much vacat time get get unlimit vacat time much time would feel comfort take much sick time get mani holiday search r cscareerquest abl get sens much vacat time softwar engin get find similar inform reilli data scienc salari survey also includ vacat inform start data scientist seattl area get 4 week pto unlimit sick time 12 holiday float;datascience
7z9ais;punch weight kaggl challeng xpost r cscareerquest tri transit data scienc field took 3 month data scienc boot camp late 2016 top taken onlin cours machin learn specif went stanford cs231n comput vision cs224n natur languag process post onlin know stanford cs depart basic post lectur note assign lectur video two cours onlin regular peopl even non stanford student could go admit alreadi knew lot materi post seem like much cours sort cursori look modern day research field decid tri hand https www kaggl com c data scienc bowl 2018 kaggl challeng specif imag segment challeng imag segment one topic cs231n touch tri hand realli abl get 10th percentil submiss tri look peopl shock mean peopl write thousand line code write incred complex model seem like realli knew purpos seem like actual cv research hand kind blind fumbl around mean model like 50 line code total pretti rudimentari wonder kind depth kaggl challeng meant peopl knowledg topic meant actual research cv scientist oppos peopl went cours onlin go challeng wrong;datascience
7z97va;aw summit 2018 opinion aw summit reason data analyst scientist attend free suppos offer cool workshop bit light detail aw knowledg certain hurt afraid go end big sale pitch anyon attend past aw summit attende want weigh;datascience
7z918e;main spoiler jon snow lie s07 expedit beyond wall jon tell jorah lord command mormont thought never come back westoro lie jon know jorah know s07 could lie bit cersei much import matter deal nk armi refus lie differ first time lie thought mayb jorah want honor back kind second time lie honor got charact lie honor demand true mean honor seem complex got certain mix selfish judgement peopl involv promis still lie lie think mean honor got;gameofthrones
7z8umr;new intern question predict mainten land data scienc internship robot compani start next coupl week look like one first big project predict mainten specif build monitor system exist model want get head start search school databas done okay becom familiar basic pdm wonder anyon help detail familiar specif data yet essenti stream collect data posit axi robot well attribut want say current flow axi torqu someth like understand model essenti unsupervis cost prohibit allow failur occur anyway three main question 1 would go creat feedback loop pdm 2 metric could use data unsupervis like suspect obvious accuraci precis recal f1 guess far would use uptim downtim sort dollar save relat prevent mainten instead predict 3 best visual guess monitor system intend client face top develop understand metric import use visual also interest know kind tool compani use produc visual thank advanc help advic anyon experi pdm direct toward especi help paper atricl would realli appreci;datascience
7z8q24;struggl data analyst hi recent graduat uni work first job startup sf mix product data analysi market data analysi 5 month work one biggest struggl abl valid under data seem look correct lot queri write sql get queri valid time time appear inconsist boss expect result one one compani alway clear point truth understand data valid accuraci integr part industri feel overwhelm expect time feel though bit junior role normal feel entri level candid boss happi inconsist feel go let soon simpli deliv high expect definit want improv know realli enjoy work data feel lost frustrat time lack clariti advic would much appreci;datascience
7z8l8t;chemic engin phd hi look advic approach 29 hit bit cross road life spent last 7 year industri pursu lot cost reduct continu improv qualiti improv manufactur sector invent patent paper resum look like mba candid phd candid right love data part job analysi problem solv use data total self taught consid best compani want want go career manag care money think go back school appli statist phd love learn spend free time learn read think enjoy process phd far see three path get want solv research problem world data take gre summer appli phd program 2019 take master math statist 2 year appli phd program realli want cost self teach everyth kaggl competit get hire data scientist somewher phd possibl master necessari appli extrem self motiv skill self teacher compet chemic engin graduat top 40 school graduat high honor linear algebra math stat peopl;datascience
7z8g1g;everyth anyon els think arya present s1 e1 counterintuit develop charact recent decid rewatch first season got time reread first book asoiaf say arya represent show realli bewild exampl arya liter introduc warrior alreadi outshoot bran bow even guid two older brother scene realli took away sens transform charact arya arya allow practic shoot bow point outshoot brother ident arya alreadi establish would lord father rest societi look negat attempt break gender norm norm clear alreadi broken lord eddard ration prohibit yield sword sure alreadi awar abil bow scene struck anyon els slight odd addit anyon els think exampl arya journey weird contradict like;gameofthrones
7z7zqt;usual hire timefram hello anyon experi give view good time appli data scienc job mid size compani mani month advanc ideal career fair receiv feedback compani earli sept 2018 start date yet time friend chose work big four research scientist softwar dev alreadi close offer know wast opportun appli onlin compani abl meet person contact sent messag recruit applic ask question receiv repli nervous need start work soon graduat stop receiv small stipend obvious would want start work intend career right gate graduat msc comput scienc august 2018 montreal canada alreadi turn one mid size compani get quit far hire process suspect small part reason hire start date far advanc;datascience
7z7xiv;tv fanmad vid arya made want share hope serious enough;gameofthrones
7z7wg9;main spoiler mani question regard season 8 tyrion still connect castl black heard sinc season 1 normal weapon temporaley knock wight get reviv remain memeb dani esso armi go turn fight arrow made dragonglass valyrian steel dragonsteel dragonglass kill white walker one dragon kill white walker dragonfir could kill white walker could jon dani burn winterfel last ditch move mani white walker general aliv men dorn would make sens drogon kill viserion drogo kill viseri screen castl black men surviv break wall dragon egg laid hatch way dani;gameofthrones
7z7trd;everyth sansa status season 8 think sansa die earli season 8 sophi hair blond seem spend time far away belfast worri kill sansa earli season 8 possibl earli seri would realli suck kill especi get kill whitewalk someth without realli prove whether play game without littlefing help;gameofthrones
7z7l0y;spoiler quick question regard fandom lore world whole anyon know websit databas wiki intent purpos master game throne fan site similar someth cool cooler pottermor https www pottermor com hp fan dead serious want build lfg p;gameofthrones
7z7e7q;main spoiler miss show made littl cartoon take edg enjoy;gameofthrones
7z7djr;everyth guid buddi first view wonder much ad detail give exampl s6e7 cersei say trial combat hound reveal aliv tell cleganebowl thought would never spoil anyth exampl gonna bring r l j piec togeth show tower joy dunno look suggest insight tri get show year almost weird tri explain thing without explain much abl discern moment ambigu point need explan moment vagu purpos confus winterfel burn s2 almost gave whole thing away;gameofthrones
7z7d5m;main spoiler night king heritag hey everyon know mani theori night king stuff well watch got hit bran took 3er role stori kept think connect nk could possibl night king actual singl person rather titl mean someth similar bran 3er type incarn seem pretti understand night king would also need succesor must probabl strong talent power similar bran perhap even king blood stark first king north boy sacrific actual meant find true succesor doubt boy surviv becom ww perhap night king might still search one thing could possibl 3er also kind weapon creat cotf think even possibl;gameofthrones
7z70fa;neural network make model base infer superflu seem deep learn chang world peopl still model base infer 10 year 20;datascience
7z6zns;main spoiler jon snow king spade digit illustr anim;gameofthrones
7z6s3k;look mentor data scienc hi current work fortun 500 basic data analysi tableau cluster linear regress correl etc look realli elev data scienc knowledg mentor take predict model model creat realli low accuraci help appreci;datascience
7z6fct;tablet data scienc curious anyon use ipad workflow;datascience
7z6bqh;everyth think sansa similar scar brand mark theon see take presum bath year see marri ramsey sleeveless gown alreadi bruis short;gameofthrones
7z678l;spoiler get inner melissandra littl scottish pub nbd seamstress friend go embellish dress heavili yay;gameofthrones
7z5zff;question help kaggl competit hello guy task tackl kaggl competit https www kaggl com c porto seguro safe driver predict datacamp cours lie complet head even sure start analys massiv data especi look take column account featur without type name everi time look extens resourc start could begin analys data thank lot;datascience
7z5pwp;spoiler art balerion black dread joshua cairó;gameofthrones
7z5741;main spoiler maisi william read end s08 say would expens shoot multipl end;gameofthrones
7z573q;spoiler final start watch mani year alreadi season 3 9 day watch say enough much love far want share communiti realli savor everi moment movi seri wish watch first time amaz know feel way finish want savor moment episod pass despit posit thing say seri find lost better part two season understand whole lord success system research realli grasp;gameofthrones
7z51f7;main spoiler singl season lannist sibl broken emot physic transform rest seri;gameofthrones
7z4uj4;data scienc formula 1 motogp nascar motorsport secret competit heavili data driven long time anyon sourc data scientist analyst role competit data infrastructur technolog use anyth provid deeper understand data scienc involv;datascience
7z4mz0;spoiler paint littl bit wall live room;gameofthrones
7z4bl7;spoiler game throne altern poster oc;gameofthrones
7z3925;one better 1 year data scienc full time program us certif cours data scienc india;datascience
7z2pdk;stanford element statist learn mooc wiki https www reddit com r datasci wiki index mooc section list two stanford class statist learn element statist learn appear link 2nd one taken anoth link somewher class remov;datascience
7z2i4b;main spoiler got charact tournament round 2 match 17 24 tournament includ 128 memor got https www hbo com game throne charact match includ 2 random charact guy vote favorit whoever receiv vote win move next round wikia page includ charact click name round 2 8 match everi day round 2 end everi charact play 32 charact move round 3 result match 9 barristan selmi beat jaqen h ghar match 10 hot pie beat qyburn match 11 bronn beat catelyn stark match 12 gendri beat orel match 13 samwel tar beat theon greyjoy match 14 oberyn martel beat tywin lannist match 15 lyanna mormont beat wun wun match 16 stanni baratheon beat qotho match match 17 maester luwin http gameofthron wikia com wiki maester_luwin vs hodor http gameofthron wikia com wiki hodor match 18 bran stark http gameofthron wikia com wiki bran_stark vs night king http gameofthron wikia com wiki night_k match 19 margaeri tyrel http gameofthron wikia com wiki margaery_tyrel vs khal drogo http gameofthron wikia com wiki khal_drogo match 20 daeneri targaryen http gameofthron wikia com wiki daenerys_targaryen vs yara greyjoy http gameofthron wikia com wiki yara_greyjoy match 21 brynden tulli http gameofthron wikia com wiki brynden_tulli vs petyr baelish http gameofthron wikia com wiki petyr_baelish match 22 arya stark http gameofthron wikia com wiki arya_stark vs nymeria sand http gameofthron wikia com wiki nymeria_sand match 23 vari http gameofthron wikia com wiki vari vs eddison tollett http gameofthron wikia com wiki eddison_tollett match 24 tormund giantsban http gameofthron wikia com wiki tormund_giantsban vs daario nahari http gameofthron wikia com wiki daario_nahari poll match 17 24 https doc googl com form e 1faipqlscbybizozoqel31idb7ozbaxcsdfwk_q_i2tep4q01uc6ywcw viewform charact move round 3 sandor clegan http gameofthron wikia com wiki sandor_clegan missandei http gameofthron wikia com wiki missandei brienn tarth http gameofthron wikia com wiki brienne_tarth podrick payn http gameofthron wikia com wiki podrick_payn eddard stark http gameofthron wikia com wiki eddard_stark jon snow http gameofthron wikia com wiki jon_snow tyrion lannist http gameofthron wikia com wiki tyrion_lannist davo seaworth http gameofthron wikia com wiki davos_seaworth barristan selmi http gameofthron wikia com wiki barristan_selmi hot pie http gameofthron wikia com wiki hot_pi bronn http gameofthron wikia com wiki bronn gendri http gameofthron wikia com wiki gendri samwel tar http gameofthron wikia com wiki samwell_tar oberyn martel http gameofthron wikia com wiki oberyn_martel lyanna mormont http gameofthron wikia com wiki lyanna_mormont stanni baratheon http gameofthron wikia com wiki stannis_baratheon round 2 elimin manc rayder http gameofthron wikia com wiki mance_rayd allis thorn http gameofthron wikia com wiki alliser_thorn joffrey baratheon http gameofthron wikia com wiki joffrey_baratheon lyanna stark http gameofthron wikia com wiki lyanna_stark roos bolton http gameofthron wikia com wiki roose_bolton jojen reed http gameofthron wikia com wiki jojen_re tickler http gameofthron wikia com wiki the_tickl ramsay bolton http gameofthron wikia com wiki ramsay_snow jaqen h ghar http gameofthron wikia com wiki jaqen_h ghar qyburn http gameofthron wikia com wiki qyburn catelyn stark http gameofthron wikia com wiki catelyn_stark orel http gameofthron wikia com wiki orel theon greyjoy http gameofthron wikia com wiki theon_greyjoy tywin lannist http gameofthron wikia com wiki tywin_lannist wun wun http gameofthron wikia com wiki wun_wun qotho http gameofthron wikia com wiki qotho round 1 elimin anguy http gameofthron wikia com wiki anguy wildl girl http gameofthron wikia com wiki wildling_girl archmaest ebros http gameofthron wikia com wiki ebros ellaria sand http gameofthron wikia com wiki ellaria_sand hizdahr zo loraq http gameofthron wikia com wiki hizdahr_zo_loraq meera reed http gameofthron wikia com wiki meera_re lancel lannist http gameofthron wikia com wiki lancel_lannist euron greyjoy http gameofthron wikia com wiki euron_greyjoy jano slynt http gameofthron wikia com wiki janos_slynt pypar http gameofthron wikia com wiki pypar ros http gameofthron wikia com wiki ros gregor clegan http gameofthron wikia com wiki gregor_clegan leaf http gameofthron wikia com wiki leaf ren baratheon http gameofthron wikia com wiki renly_baratheon viseri targaryen http gameofthron wikia com wiki viserys_targaryen randyl tar http gameofthron wikia com wiki randyll_tar unella http gameofthron wikia com wiki unella harrag http gameofthron wikia com wiki harrag syrio forel http gameofthron wikia com wiki syrio_forel thoro myr http gameofthron wikia com wiki thoros_of_myr shae http gameofthron wikia com wiki shae lock http gameofthron wikia com wiki lock boro blount http gameofthron wikia com wiki boros_blount lora tyrel http gameofthron wikia com wiki loras_tyrel ilyn payn http gameofthron wikia com wiki ilyn_payn talisa stark http gameofthron wikia com wiki talisa_maegyr beric dondarrion http gameofthron wikia com wiki beric_dondarrion jeor mormont http gameofthron wikia com wiki jeor_mormont othel yarwyck http gameofthron wikia com wiki othell_yarwyck kevan lannist http gameofthron wikia com wiki kevan_lannist robin arryn http gameofthron wikia com wiki robin_arryn tyen sand http gameofthron wikia com wiki tyene_sand craster http gameofthron wikia com wiki craster melisandr http gameofthron wikia com wiki melisandr xaro xhoan daxo http gameofthron wikia com wiki xaro_xhoan_daxo olli http gameofthron wikia com wiki olli mirri maz duur http gameofthron wikia com wiki mirri_maz_duur meryn trant http gameofthron wikia com wiki meryn_tr myrcella baratheon http gameofthron wikia com wiki myrcella_baratheon selys baratheon http gameofthron wikia com wiki selyse_baratheon maester wolkan http gameofthron wikia com wiki wolkan mace tyrel http gameofthron wikia com wiki mace_tyrel waif http gameofthron wikia com wiki the_waif gilli http gameofthron wikia com wiki gilli doran martel http gameofthron wikia com wiki doran_martel lysa arryn http gameofthron wikia com wiki lysa_arryn styr http gameofthron wikia com wiki styr harald karstark http gameofthron wikia com wiki harald_karstark dickon tar http gameofthron wikia com wiki dickon_tar grenn http gameofthron wikia com wiki grenn polliv http gameofthron wikia com wiki polliv obara sand http gameofthron wikia com wiki obara_sand lord bone http gameofthron wikia com wiki lord_of_bon arthur dayn http gameofthron wikia com wiki arthur_dayn cersei lannist http gameofthron wikia com wiki cersei_lannist balon greyjoy http gameofthron wikia com wiki balon_greyjoy edmur tulli http gameofthron wikia com wiki edmure_tulli grand maester pycell http gameofthron wikia com wiki pycell shireen baratheon http gameofthron wikia com wiki shireen_baratheon high sparrow http gameofthron wikia com wiki high_sparrow donto hollard http gameofthron wikia com wiki dontos_hollard maester aemon http gameofthron wikia com wiki aemon myranda http gameofthron wikia com wiki myranda yohn royc http gameofthron wikia com wiki yohn_royc;gameofthrones
7z22c6;topic googl search hi guy websit host abn inform use third page fourth result googl name girl fight tinder suss facebook profil got guy write comment websit say huge woman abus huge collect abus women onlin unfit work rent bother much complet bullshit know fact hr go probabl either get turn question idea handl tri contact site admin ignor tri contact compani handl comment system report comment avail fact probabl half problem 4th site come googl quit distress wonder hell current get background check compani explain hard mention hr peopl research type take shit realli serious kind word wisdom advic appreci;datascience
7z1ruq;spoiler known;gameofthrones
7z0tps;tech ceo understand ai research done compani think peopl like mark zuckerberg take time understand theori math behind ai research team conduct;datascience
7z0r32;start data scienc machin learn udemi cours kiril eremenko jose portilla hey guy play around python week know basic want enrol one cours either python data scienc machin learn bootcamp jose portilla https www udemi com python data scienc machin learn bootcamp machin learn z hand python r data scienc kiril eremenko https www udemi com machinelearn want feedback recommend one want kaggl competit im finish;datascience
7z0mvi;time seri analysi ok autom finish chapter tsa book go theori pacf acf generat function back shift oper coeffici main theme seem remov trend look pacf acf decid ar term look generat function determin time seri invert right also seem like packag autom process look pacf acf valu select term base whether valu higher confid interv straight give model free even tell differ coeffici consid safe let softwar packag autom process long verifi pacf acf gf coeffici agre model select reason;datascience
