id;cleaned_words;subreddit
7yr0ep;main spoiler friend made awesom edit got tribut thought guy would realli appreci;gameofthrones
7yqr0o;deep learn ai futur;datascience
7yqfm3;share bash_profil vim profil look custom mine data scienc look idea titl;datascience
7yq7zg;main spoiler small moment nobodi talk might one sweetest touch moment two tyrion propos speak cersei alon dragonpit meet go well jon public swear allegi dani front cersei dani one everybodi protest go talk cersei fear kill felt small moment emot impact reason first rememb one time show someon idea tyrion someth danger could die nobodi overprotect dani despit mistak made season 7 give still need also choic word realli stood come way hand murder lost love one care journey get back westero came back lose child beyond wall possibl go lose close friend someon form special bond troubl underneath still deepli love care point like famili tyrion want everyth went tri get help cersei great war show proof wws exist noth risk die especi sinc idea least tri right back start sweet dani want understood respect appreci reluct accept good thing realli came least tyrion get cersei public promis help jaim side valuabl inform cersei realli plan moment also felt realli mirror scene tyrion beg go eastwatch moment felt littl power least see feel mutual protect one anoth hurt stand thought one die love show handl film scene kept camera focus dani tyrion two separ scene watch leav;gameofthrones
7yq6f9;data scienc vs softwar engin current debat career data scienc one softwar engin seem data scientist first foremost exact scientist ask question seek answer fundament make good data scientist knack ask right question know go look next receiv answer hand softwar engin concern design build softwar fundament qualiti softwar engin knack good solid aesthet design optim readabl code parsimoni code data scientist embrac messi deriv mean softwar engin embrac structur use build accur assess final much engin go data scienc;datascience
7ypqjt;main spoiler valyrian steel sword futur spoiler think melt sword throne theoret valyrian steel sword rememb previous king melt sword dragon fire melt fix fight night king armi need sort magic becom valyrian steel;gameofthrones
7ypncv;data scienc foundat special relat newbi world data scienc 60 way u mich intro appli data scienc python cours coursera go self taught mooc rout struggl bit next step finish u mich 5 cours seri read fair number post articl comment point fast evolv natur field prohibit anyon familiar topic given would see foundat skill someon interest data scienc skill anyon field would need foundat laid common rout special within data scienc;datascience
7ypiq9;data pipelin engin one suggest good resourc learn data pipelin process feel one skill lack scientif comput experi python julia noth term creat data pipelin backend framework help start learn would great appreci;datascience
7yp7y3;truck beer textual analysi 12 446 countri song oc;datascience
7yoqg7;structur data scienc project use github python structur doc test data mayb make new python packag analysi etc;datascience
7yoc85;spoiler game throne theme playlist tri develop playlist inspir got without use much origin soundtrack suggest song accur emul tone theme got exampl beneath brine famili crest seem like good song theon greyjoy general;gameofthrones
7yo7e3;spoiler daeneri drogon fan creation daniel kamarudin;gameofthrones
7yntp4;spoiler recondit stain glass window local music store venu use church grow strong;gameofthrones
7ynt4e;everyth want show got collect peopl would appreci;gameofthrones
7ymt6f;need help futur kind thing special current studi master degre ugr stude basic thing like classif regress decis rule start see big data deep learn data scienc huge field knowledg sure would like special work futur final degre project sentiment analysi interest field studi right know wonder skill softwar framework requir start work good decent compani soon get master degre guy work kind compani experi recommend welcom would like get feedback peopl experi real world right environ pure educ thank advanc sorri clumsi english nativ speaker best;datascience
7yml6j;everyth game throne monopoli board design templat comment;gameofthrones
7ymkvg;tableau worth learn goal find work data scientist;datascience
7ym1m9;everyth night king biggest secret potenti reason invas came across interest articl night king actual azor ahai wife turn white walker nissa nissa reason attack check opinion pretti interest possibl never explor leav link https us blastingnew com showbiz tv 2018 02 game throne night king biggest secret expos 002366565 html;gameofthrones
7yle5s;hire data scientist current process build busi line data scienc function hope could get coupl pointer histor hire pure quant role specif best board post role compani post linkedin websit default particular target question exercis think give fairest reflect interviewe skillset limit practic experi factor think good indic genuin skill passion context role london junior vp level financ though open non financ background good pay interest work;datascience
7yldul;factor variabl consid tri flag suspici transact financi institut tri get understand area fraud detect data scienc general find sourc say detect pattern transact data identifi fraud activ never figur exact variabl financi payment process compani like look begin deal challeng around aml fraud detect transact flag complianc look exhaust list though would great someon throw light import obvious variabl also identifi variabl data mine techniqu deploy final flag transact addit inform much appreci thank advanc;datascience
7ykfum;spoiler water garden dorn;gameofthrones
7ykd0s;need python lib draw custom heatmap hello data scientist need draw heatmap similar https ibb co byhkg one know due tool found heatmap limit draw inner part imag thank;datascience
7yk2ml;everyth twist certain charact okay let face jon get north daeneri think north go take kind bend knee even bet sansa may happi lot peopl think arya support jon bend knee think still love jon may respect dani think still definit problem jon bend knee mayb much everyon els think issu jon bend knee four reason 1 start order arya would still see like northern dani mad king granddaught e man kill grandfath uncl 2 arya would also problem vari saw tomb kl also jon bran forgiv jaim 3 jon may also tri make arya stay wf fight due mayb alittl overprotect obvious reason 4 realli think arya pov iron found jon king find gave foreign woman never even met also granddaught mad man would furious could see relationship jon take jon away wolfpack yes think like sansa could grow like dani person think still problem jon bend knee;gameofthrones
7yjtjo;everyth question arya sansa season 7 sansa talk baelish arya might betray thought would turn jon misquot someth along line sansa assum know arya liter seen sinc season 1 transform experi complet chang charact outlook seem pretti clear evid convers unless sansa tri throw baelish loop arya sansa relationship season 7 make littl sens would even perceiv tension miss someth;gameofthrones
7yjpcm;data scienc new zealand anyon subreddit nz wife job offer look possibl reloc familiar compani best place look data scienc relat job;datascience
7yji9s;wall poster idea wife got first job data scientist want decor offic cool look poster relat data scienc statist etc want surpris one plan frame appropri realli sure start could anyon offer suggest;datascience
7yj9jb;tv rain castamer stairwel dope reverb;gameofthrones
7yj95c;main spoiler week rewatch season 3 episod 4 watch end s3e4 watch end air 21 april 2013 written david benioff b weiss direct alex grave imdb score 9 6 hbo episod synopsi night watch take stock vari meet better arya taken command brotherhood daeneri make exchang episod thread episod thread insid episod 4 21 2013 r gameofthron 1crc10 insid ep https www youtub com watch v 7a8m dakmvc link r gameofthron discord server live rewatch discuss https discord gg vkubmtx ozzymanreview video review https www youtub com watch v awxvw88fccu;gameofthrones
7yirrw;need advic non compet offer broad non compet claus could someon familiar pm;datascience
7yiq17;advic career help foot door opportun work role extract data produc simpl stat want game move bit toward model make predict base data two question 1 alreadi tech skill better choos specif project learn job onlin cours get theori attempt appli skill 2 opportun might get job figur model would like describ process hope someon give pointer get start essenti 3 count count come count goe b go b c b count go c c consid togeth separ 2 divis within second tier process everyth come b go c flow c relev model simpl flow 2 level process 14 data type come goe happen time 3 8 month b 4 6 month back c want abl chart predict might big peak drop come c point 14 differ data type lag time got stuck use simpl financi year group perhap wide given time period flow hope make sens anyon help add use excel sas basic thing thank advanc;datascience
7yij98;spoiler beauti melisandr;gameofthrones
7yigxr;import certif hi academ scientist look move toward data scienc learn new skill facilit includ crash cours sql gather help find job feel confid enough basic sql wonder worthwhil take certif look oracl set cert good choic cert seen valuabl employ;datascience
